ticker,date,article_datetime,title,polarity,neg,neu,pos
AMZN,2025-02-06,2025-02-06T14:33:16+00:00,"You Can Buy Rivian's Van, But Don't Come A Knockin' On RIVN, Analyst Warns",0.681,0.0,0.917,0.083
AMZN,2025-02-06,2025-02-06T14:30:40+00:00,"Stock market today: S&amp;P 500, Nasdaq edge higher with Amazon set to highlight earnings rush",0.989,0.075,0.819,0.106
AMZN,2025-02-06,2025-02-06T13:41:48+00:00,"Amazon Earnings Due Today. Cloud Growth Is In Focus After Microsoft, Google Stumbles.",0.178,0.0,0.941,0.059
AMZN,2025-02-06,2025-02-06T13:32:46+00:00,Why Trump's repeal of a trade loophole will hurt low-income and minority Americans,0.982,0.035,0.895,0.07
AMZN,2025-02-06,2025-02-06T13:20:15+00:00,Is PDD Holdings (PDD) the Best E-Commerce Stock to Buy According to Analysts?,0.994,0.017,0.899,0.084
AMZN,2025-02-06,2025-02-06T13:00:00+00:00,These People Turned AirPods Into Hearing Aids. Here Are the Pros and Cons.,0.318,0.065,0.816,0.118
AMZN,2025-02-06,2025-02-06T13:00:00+00:00,Buy This Tech Stock (Shopify) Down 25% Before Earnings?,0.997,0.02,0.858,0.122
AMZN,2025-02-06,2025-02-06T12:20:00+00:00,Buy Amazon Ahead of Earnings Today on Strong EPS Estimate Revisions,0.999,0.007,0.81,0.183
AMZN,2025-02-06,2025-02-06T12:08:54+00:00,Q3 2025 Bark Inc Earnings Call,1.0,0.017,0.801,0.181
AMZN,2025-02-06,2025-02-06T12:00:23+00:00,Big Tech's CapEx spending growth exceeding revenue growth,0.818,0.0,0.949,0.051
AMZN,2025-02-06,2025-02-06T11:22:39+00:00,"Trending tickers: Amazon, Qualcomm, Arm, Nissan and AstraZeneca",0.996,0.016,0.894,0.09
AMZN,2025-02-06,2025-02-06T10:47:51+00:00,"Amazon Cloud Needs to Deliver After Microsoft, Alphabet Misses",0.997,0.051,0.827,0.121
AMZN,2025-02-06,2025-02-06T10:34:00+00:00,"The Zacks Analyst Blog Highlights Amazon, Bank of America, Caterpillar, NVE and bioAffinity",0.999,0.033,0.821,0.146
AMZN,2025-02-06,2025-02-06T09:22:00+00:00,"The ""Magnificent Seven"" Stocks Could Help This Vanguard ETF Turn $400 per Month Into $1 Million",0.999,0.031,0.828,0.141
AMZN,2025-02-06,2025-02-06T09:05:25+00:00,"Futures higher, Amazon to report, earnings deluge - what's moving markets",0.86,0.072,0.841,0.088
AMZN,2025-02-06,2025-02-06T08:10:14+00:00,"Shein, Temu Retailers Slapped With 30% Levy on US-Bound Goods",-0.975,0.077,0.866,0.057
AMZN,2025-02-06,2025-02-06T06:00:37+00:00,The most popular stocks and funds for investors in January,0.999,0.036,0.827,0.137
AMZN,2025-02-06,2025-02-06T00:00:00+00:00,"Amazon EPS Jumps 86%, Beats Forecasts",0.477,0.071,0.743,0.186
GOOGL,2023-07-25,2023-07-25T23:59:30+00:00,AI lesson for Microsoft and Google: Spend money to make money,0.877,0.02,0.927,0.053
GOOGL,2023-07-25,2023-07-25T23:49:00+00:00,Google and Microsoft Paying Big to Play in AI,0.927,0.0,0.822,0.178
GOOGL,2023-07-25,2023-07-25T23:42:05+00:00,Alphabet’s digital advertising business shows signs of resilience,0.586,0.033,0.869,0.098
GOOGL,2023-07-25,2023-07-25T23:22:00+00:00,Google Shakes Up Top Finance Role as It Posts Accelerating Growth,0.671,0.0,0.744,0.256
GOOGL,2023-07-25,2023-07-25T23:00:00+00:00,Elon Musk Pursues Banking in Wake of Rivals’ Failed Attempts,0.99,0.057,0.853,0.09
GOOGL,2023-07-25,2023-07-25T22:00:02+00:00,"Compared to Estimates, Alphabet (GOOGL) Q2 Earnings: A Look at Key Metrics",0.969,0.0,0.944,0.056
GOOGL,2023-07-25,2023-07-25T22:00:00+00:00,"Cavalcade of Earnings: MSFT, GOOGL, SNAP &amp; More",0.999,0.023,0.812,0.166
GOOGL,2023-07-25,2023-07-25T21:53:34+00:00,Alphabet Stock Is Soaring After Earnings. Is GOOGL Stock a Buy Now?,0.077,0.055,0.882,0.063
GOOGL,2023-07-25,2023-07-25T21:51:59+00:00,"Microsoft, Google Are Key Earnings Movers Late After S&amp;P 500 Hits New High; Fed Rate Hike Due",0.0,0.0,1.0,0.0
GOOGL,2023-07-25,2023-07-25T21:46:00+00:00,Alphabet Spikes on Earnings. Its CFO Is Getting a New Role.,0.7,0.0,0.791,0.209
GOOGL,2023-07-25,2023-07-25T21:25:08+00:00,Alphabet (GOOGL) Q2 Earnings and Revenues Surpass Estimates,0.996,0.01,0.886,0.104
GOOGL,2023-07-25,2023-07-25T21:23:50+00:00,"UPS-Teamster deal, PacWest merger, Alphabet exec changeup: Top stories",0.305,0.05,0.895,0.056
GOOGL,2023-07-25,2023-07-25T21:15:05+00:00,Alphabet Inc. (GOOG) Q2 Earnings and Revenues Surpass Estimates,0.996,0.01,0.884,0.106
GOOGL,2023-07-25,2023-07-25T21:14:54+00:00,Microsoft becoming 'Death Star' of tech while optimizing faster into AI: Strategist,0.998,0.023,0.866,0.112
GOOGL,2023-07-25,2023-07-25T21:02:51+00:00,Google defies ChatGPT threat as sales jump,1.0,0.065,0.844,0.091
GOOGL,2023-07-25,2023-07-25T20:47:10+00:00,"Google Earnings, Revenue Beat Estimates As Porat Promoted To President",0.361,0.0,0.884,0.116
GOOGL,2023-07-25,2023-07-25T20:37:00+00:00,"All Eyes Are on Alphabet, Microsoft, but Will Buying Fatigue Set In?",-0.078,0.053,0.903,0.044
GOOGL,2023-07-25,2023-07-25T20:30:55+00:00,"Alphabet’s longest-serving CFO Ruth Porat promoted, stock surges over 6% on earnings beat",0.99,0.0,0.86,0.14
GOOGL,2023-07-25,2023-07-25T20:29:41+00:00,Google rebounds from unprecedented drop in ad revenue with a resurgence that pushes stock higher,0.99,0.02,0.884,0.096
GOOGL,2023-07-25,2023-07-25T20:22:00+00:00,"Google Surges On Q2 Earnings Beat, New Role For CFO Ruth Porat",0.318,0.0,0.916,0.084
GOOGL,2023-07-25,2023-07-25T19:00:33+00:00,"Meta exec Nick Clegg on AI: ""I definitely think you need regulation""",0.952,0.031,0.893,0.075
GOOGL,2023-07-25,2023-07-25T18:46:03+00:00,"Dow futures slip as Microsoft, Alphabet report earnings",0.902,0.017,0.924,0.059
GOOGL,2023-07-25,2023-07-25T18:04:38+00:00,US STOCKS-Wall Street climbs on Big Tech enthusiasm,0.997,0.024,0.832,0.145
GOOGL,2023-07-25,2023-07-25T16:51:36+00:00,Stock market today: Dow extends win streak as tech shines ahead of earnings,0.993,0.022,0.866,0.112
GOOGL,2023-07-25,2023-07-25T16:43:59+00:00,"Meta earnings preview: Ads, AI, and Threads to take center stage",0.992,0.008,0.904,0.088
GOOGL,2023-07-25,2023-07-25T16:36:00+00:00,Google Is Expected to Post Accelerating Growth as Online Ads Recover,0.671,0.0,0.744,0.256
GOOGL,2023-07-25,2023-07-25T16:23:18+00:00,"US STOCKS-Wall Street climbs ahead of Big Tech results, Fed rate hike",0.994,0.035,0.846,0.12
GOOGL,2023-07-25,2023-07-25T16:03:59+00:00,ChatGPT now on Android in some countries including US,0.967,0.0,0.851,0.149
GOOGL,2023-07-25,2023-07-25T15:12:33+00:00,"S&amp;P 500 rises on tech strength ahead of Microsoft, Alphabet Results",0.961,0.018,0.912,0.07
GOOGL,2023-07-25,2023-07-25T14:46:24+00:00,"Dow Jones, Nasdaq Rise As Earnings Roll; Fed Meeting, Microsoft, Google In Focus",0.0,0.0,1.0,0.0
GOOGL,2023-07-25,2023-07-25T14:37:49+00:00,"Alphabet earnings: What to watch for as Google parent gives update on AI, search",0.637,0.0,0.874,0.126
GOOGL,2023-07-25,2023-07-25T14:25:14+00:00,"US STOCKS-Nasdaq, S&amp;P 500 climb ahead of Big Tech results, Fed rate hike",0.993,0.027,0.863,0.11
GOOGL,2023-07-25,2023-07-25T13:37:24+00:00,"Dow Jones Dips, Nasdaq Rises As Earnings Roll; Fed Meeting, Microsoft, Google In Focus",0.0,0.0,1.0,0.0
GOOGL,2023-07-25,2023-07-25T13:19:13+00:00,"GM &amp; Spotify results, big day for earnings: Top stories",0.44,0.034,0.87,0.096
GOOGL,2023-07-25,2023-07-25T12:00:15+00:00,Is Alphabet Inc.'s (NASDAQ:GOOGL) Recent Stock Performance Tethered To Its Strong Fundamentals?,0.999,0.004,0.829,0.167
GOOGL,2023-07-25,2023-07-25T11:30:34+00:00,U.S. stocks were rising as Microsoft and Alphabet kick off tech earnings,0.988,0.022,0.867,0.111
GOOGL,2023-07-25,2023-07-25T11:30:00+00:00,"Amesite Announces Integration Capability with LMS Platforms, Bringing AI to Organizations with Existing Contract Commitments",0.979,0.022,0.897,0.081
GOOGL,2023-07-25,2023-07-25T11:07:41+00:00,"FOREX-Euro slips further on gloomy data, China's yuan surges",0.968,0.031,0.898,0.072
GOOGL,2023-07-25,2023-07-25T10:49:44+00:00,Top 20 Electronic Gadgets for a Smart Home,1.0,0.02,0.775,0.205
GOOGL,2023-07-25,2023-07-25T10:46:51+00:00,"Dow Jones Futures Rise As Dow Rides Win Streak; Fed Meeting, Tech Titans On Tap",0.44,0.08,0.759,0.16
GOOGL,2023-07-25,2023-07-25T10:42:00+00:00,Microsoft and Alphabet Earnings Are Critical for This Stock Market Rally. Here’s Why.,-0.527,0.173,0.827,0.0
GOOGL,2023-07-25,2023-07-25T10:30:00+00:00,2 Cybersecurity Stocks You Can Buy and Hold for the Next Decade,0.0,0.0,1.0,0.0
GOOGL,2023-07-25,2023-07-25T10:06:15+00:00,15 Most Walkable Cities in the US,0.999,0.006,0.899,0.094
GOOGL,2023-07-25,2023-07-25T10:02:00+00:00,"Stocks Mixed, General Motors, General Electric, Google, Microsoft Earnings On Deck - 5 Things To Know",0.743,0.028,0.81,0.162
GOOGL,2023-07-25,2023-07-25T10:00:00+00:00,MORNING BID AMERICAS-Big Tech litmus test as Fed gathers,0.967,0.049,0.868,0.084
GOOGL,2023-07-25,2023-07-25T09:49:09+00:00,20 Most Trusted Professions in America,1.0,0.032,0.716,0.251
GOOGL,2023-07-25,2023-07-25T09:40:45+00:00,"AI’s Grip on Tech Set for Test With Microsoft, Alphabet Earnings",0.976,0.04,0.894,0.066
GOOGL,2023-07-25,2023-07-25T09:37:00+00:00,"These Stocks Are Moving the Most Today: F5, Logitech, Cadence Design, GE, GM, Microsoft, Alphabet, and More",0.772,0.0,0.811,0.189
GOOGL,2023-07-25,2023-07-25T09:32:00+00:00,New Investor? Buy These 2 Growth Stocks,0.625,0.0,0.796,0.204
GOOGL,2023-07-25,2023-07-25T09:30:00+00:00,Inside Google’s scramble to reinvent its $160 billion search business—and survive the A.I. revolution,1.0,0.057,0.841,0.102
GOOGL,2025-02-04,2025-02-04T23:23:17+00:00,"Alphabet reverses ban on AI use for weapons, following Palantir",-0.494,0.055,0.898,0.047
GOOGL,2025-02-04,2025-02-04T23:09:12+00:00,"AMD, Alphabet fall after Q4 results: Biggest earnings takeaways",-0.836,0.07,0.909,0.02
GOOGL,2025-02-04,2025-02-04T23:05:26+00:00,"AI data center play 'reinforced' by Alphabet, Microsoft spending",0.402,0.046,0.897,0.056
GOOGL,2025-02-04,2025-02-04T22:45:00+00:00,Alphabet stock falls after missing revenue expectations despite strong momentum,0.992,0.019,0.882,0.099
GOOGL,2025-02-04,2025-02-04T22:38:00+00:00,Alphabet Revenue Misses Expectations. The Stock Is Down Sharply.,0.026,0.086,0.824,0.09
GOOGL,2025-02-04,2025-02-04T22:30:56+00:00,Google Earnings Edge By Estimates As 2025 Capital Spending Outlook Spooks Wall Street,0.0,0.0,1.0,0.0
GOOGL,2025-02-04,2025-02-04T22:30:03+00:00,Alphabet (GOOGL) Reports Q4 Earnings: What Key Metrics Have to Say,0.979,0.0,0.931,0.069
GOOGL,2025-02-04,2025-02-04T22:17:34+00:00,Alphabet expands CapEx forecast amid Cloud's Q4 revenue miss,0.566,0.055,0.88,0.065
GOOGL,2025-02-04,2025-02-04T22:10:07+00:00,Alphabet (GOOGL) Beats Q4 Earnings and Revenue Estimates,0.995,0.005,0.899,0.095
GOOGL,2025-02-04,2025-02-04T22:10:06+00:00,Alphabet Inc. (GOOG) Q4 Earnings and Revenues Top Estimates,0.995,0.01,0.892,0.098
GOOGL,2025-02-04,2025-02-04T21:46:57+00:00,Alphabet posts Q4 revenue miss on light cloud revenue; shares fall in afterhours,0.026,0.05,0.895,0.055
GOOGL,2025-02-04,2025-02-04T21:37:22+00:00,Alphabet Fourth-Quarter Revenue Misses View; Shares Decline After Hours,0.0,0.0,1.0,0.0
GOOGL,2025-02-04,2025-02-04T21:35:56+00:00,Google's rising holiday's season ad sales aren't enough to ease worries about AI letdown,0.993,0.053,0.828,0.118
GOOGL,2025-02-04,2025-02-04T21:34:34+00:00,Is Alphabet Inc. (GOOGL) One of Bill Ackman’s Top Stock Picks?,0.995,0.008,0.913,0.079
GOOGL,2025-02-04,2025-02-04T21:13:38+00:00,Alphabet’s (NASDAQ:GOOGL) Q4 Earnings Results: Revenue In Line With Expectations But Stock Drops,0.999,0.017,0.845,0.138
GOOGL,2025-02-04,2025-02-04T21:01:34+00:00,"Stock market today: Dow, S&amp;P 500, Nasdaq recover as traders assess tariff developments, new jobs data",0.998,0.057,0.862,0.082
GOOGL,2025-02-04,2025-02-04T18:37:39+00:00,How To Earn $500 A Month From Alphabet Stock Ahead Of Q4 Earnings (CORRECTED),0.986,0.005,0.915,0.079
GOOGL,2025-02-04,2025-02-04T10:47:13+00:00,"Trending tickers: Alphabet, Tesla, Palantir, Super Micro Computer and Vodafone",0.997,0.048,0.846,0.106
GOOGL,2025-02-04,2025-02-04T08:59:35+00:00,China Hits Back Against Trump’s Tariffs With Targeted Actions,-0.652,0.06,0.875,0.065
GOOGL,2025-02-04,2025-02-04T07:01:00+00:00,Alphabet Earnings Could Provide Answers on AI and Cloud Concerns,0.296,0.0,0.965,0.035
GOOGL,2025-02-04,2025-02-04T06:58:53+00:00,Gold steady near record high as Trump starts US-China trade war,-0.962,0.11,0.816,0.073
GOOGL,2025-02-04,2025-02-04T06:04:39+00:00,"China announces measures against Google, other US firms, as trade tensions escalate",0.128,0.039,0.918,0.043
GOOGL,2025-02-04,2025-02-04T05:57:13+00:00,Copper Pares Gain as US and China Exchange Blows in Trade Fight,0.795,0.058,0.855,0.087
GOOGL,2025-02-04,2025-02-04T00:50:40+00:00,"Stock market today: Dow, S&amp;P 500, Nasdaq futures edge lower as China hits back on tariffs",0.67,0.059,0.869,0.072
GOOGL,2025-02-04,2025-02-04T00:00:00+00:00,Investing in Genomics Stocks,0.0,0.0,1.0,0.0
GOOGL,2025-02-04,2025-02-04T00:00:00+00:00,"Alphabet earnings, Fed commentary, JOLTS data: What to Watch",-0.417,0.034,0.957,0.009
META,2023-07-26,2023-07-26T21:29:06+00:00,Meta Is Lowering Its 2023 Capital Expenditure -- Could This Spell Trouble for Nvidia?,0.402,0.0,0.928,0.072
META,2023-07-26,2023-07-26T20:05:00+00:00,Meta Reports Second Quarter 2023 Results,0.999,0.031,0.89,0.079
META,2023-07-26,2023-07-26T19:33:14+00:00,It Will Take Much More Than A Snap For Snap To Overcome Its Challenges,0.997,0.05,0.807,0.143
META,2023-07-26,2023-07-26T19:08:02+00:00,"Dow futures lift after Fed rate hike, Meta surges 7% after earnings",0.785,0.019,0.941,0.041
META,2023-07-26,2023-07-26T15:11:05+00:00,Top 15 VR Games to Download and Play in 2023,0.996,0.04,0.868,0.092
META,2023-07-26,2023-07-26T11:16:42+00:00,U.S. stocks were wobbling ahead of Fed's rate decision as big tech reports,0.572,0.066,0.863,0.07
META,2023-07-26,2023-07-26T10:15:00+00:00,Mark Zuckerberg Just Gave These Stocks a Boost,0.813,0.056,0.728,0.216
META,2023-07-26,2023-07-26T05:15:55+00:00,"Fed decision looms, Microsoft and Alphabet earnings - what's moving markets",0.98,0.044,0.875,0.081
META,2023-07-26,2023-07-26T05:14:08+00:00,4 big analyst picks: Meta Platforms raised to Buy ahead of Q2,0.993,0.017,0.844,0.139
MSFT,2023-07-25,2023-07-25T23:59:30+00:00,AI lesson for Microsoft and Google: Spend money to make money,0.877,0.02,0.927,0.053
MSFT,2023-07-25,2023-07-25T23:49:00+00:00,Google and Microsoft Paying Big to Play in AI,0.927,0.0,0.822,0.178
MSFT,2023-07-25,2023-07-25T23:22:37+00:00,Microsoft’s Azure Slowdown Overshadows Optimism About AI Growth,0.999,0.029,0.847,0.124
MSFT,2023-07-25,2023-07-25T23:15:00+00:00,Microsoft Stock Slips Despite Strong Earnings. Guidance Fell Shy of Expectations.,0.026,0.075,0.849,0.076
MSFT,2023-07-25,2023-07-25T22:42:05+00:00,"If You Can Only Buy 1 Long-Term Stock, It Better Be One of These Names",0.999,0.033,0.814,0.153
MSFT,2023-07-25,2023-07-25T22:12:37+00:00,"Microsoft Cloud Business Boosts Results, But Shares Sink On Outlook",0.671,0.0,0.776,0.224
MSFT,2023-07-25,2023-07-25T22:00:00+00:00,"Cavalcade of Earnings: MSFT, GOOGL, SNAP &amp; More",0.999,0.023,0.812,0.166
MSFT,2023-07-25,2023-07-25T21:51:59+00:00,"Microsoft, Google Are Key Earnings Movers Late After S&amp;P 500 Hits New High; Fed Rate Hike Due",0.0,0.0,1.0,0.0
MSFT,2023-07-25,2023-07-25T21:41:46+00:00,3 Metaverse Stocks You Better Be Buying on Each and Every Dip,0.999,0.006,0.843,0.152
MSFT,2023-07-25,2023-07-25T21:35:37+00:00,Microsoft reports slowing cloud growth as it awaits AI revenue,0.66,0.0,0.748,0.252
MSFT,2023-07-25,2023-07-25T21:35:09+00:00,Microsoft (MSFT) Surpasses Q4 Earnings and Revenue Estimates,0.995,0.005,0.899,0.096
MSFT,2023-07-25,2023-07-25T21:14:54+00:00,Microsoft becoming 'Death Star' of tech while optimizing faster into AI: Strategist,0.998,0.023,0.866,0.112
MSFT,2023-07-25,2023-07-25T21:07:54+00:00,Microsoft revenue rises despite slowing Azure cloud platform growth,0.936,0.0,0.845,0.155
MSFT,2023-07-25,2023-07-25T20:37:00+00:00,"All Eyes Are on Alphabet, Microsoft, but Will Buying Fatigue Set In?",-0.078,0.053,0.903,0.044
MSFT,2023-07-25,2023-07-25T20:22:47+00:00,Microsoft stock slips despite earnings beat,0.997,0.006,0.872,0.122
MSFT,2023-07-25,2023-07-25T20:16:44+00:00,US STOCKS-AI mania drives Wall Street to higher close ahead of earnings,0.997,0.022,0.845,0.134
MSFT,2023-07-25,2023-07-25T20:16:00+00:00,"These Stocks Moved the Most Today: GE, GM, RTX, Spotify, Alaska Air, and More",0.599,0.04,0.842,0.118
MSFT,2023-07-25,2023-07-25T20:14:36+00:00,"Microsoft reports $20.1B quarterly profit as it promises to lead ""the new AI platform shift""",0.988,0.038,0.858,0.103
MSFT,2023-07-25,2023-07-25T20:09:07+00:00,"Microsoft stock drops as Azure growth slows, earnings top estimates",0.977,0.007,0.923,0.07
MSFT,2023-07-25,2023-07-25T19:00:33+00:00,"Meta exec Nick Clegg on AI: ""I definitely think you need regulation""",0.952,0.031,0.893,0.075
MSFT,2023-07-25,2023-07-25T18:55:00+00:00,Why Meta Platforms Stock Got Upgraded Just One Day Before Earnings,0.572,0.0,0.734,0.266
MSFT,2023-07-25,2023-07-25T18:46:03+00:00,"Dow futures slip as Microsoft, Alphabet report earnings",0.902,0.017,0.924,0.059
MSFT,2023-07-25,2023-07-25T16:51:36+00:00,Stock market today: Dow extends win streak as tech shines ahead of earnings,0.993,0.022,0.866,0.112
MSFT,2023-07-25,2023-07-25T16:33:48+00:00,Microsoft rolls Bing Chat out to a wider audience,0.934,0.034,0.887,0.078
MSFT,2023-07-25,2023-07-25T16:26:24+00:00,"Ron DeSantis Escapes Car Accident Unhurt En Route To Campaign Event, TikTok Takes On Twitter, Analysts Expect Nvidia's AI Revenues To Reach $300B In Five Years: Today's Top Stories",0.979,0.066,0.85,0.084
MSFT,2023-07-25,2023-07-25T16:00:00+00:00,"Microsoft Earnings Have Been Hurt by Cooling Software Demand, Boosted by AI",0.44,0.0,0.854,0.146
MSFT,2023-07-25,2023-07-25T15:55:21+00:00,PayPal Uses AI To Improve Its Productivity,0.999,0.037,0.792,0.17
MSFT,2023-07-25,2023-07-25T15:12:33+00:00,"S&amp;P 500 rises on tech strength ahead of Microsoft, Alphabet Results",0.961,0.018,0.912,0.07
MSFT,2023-07-25,2023-07-25T14:46:24+00:00,"Dow Jones, Nasdaq Rise As Earnings Roll; Fed Meeting, Microsoft, Google In Focus",0.0,0.0,1.0,0.0
MSFT,2023-07-25,2023-07-25T14:37:42+00:00,"7 Top AI Companies Including Microsoft, Amazon, and Alphabet Signed a Safety Pact: Here's What It Means",0.477,0.0,0.829,0.171
MSFT,2023-07-25,2023-07-25T14:25:14+00:00,"US STOCKS-Nasdaq, S&amp;P 500 climb ahead of Big Tech results, Fed rate hike",0.993,0.027,0.863,0.11
MSFT,2023-07-25,2023-07-25T14:23:00+00:00,3 Robinhood Stocks to Buy and Hold Forever,0.922,0.0,0.831,0.169
MSFT,2023-07-25,2023-07-25T13:40:41+00:00,Microsoft earnings preview: Focus on cloud rebound and AI,0.891,0.027,0.911,0.061
MSFT,2023-07-25,2023-07-25T13:37:24+00:00,"Dow Jones Dips, Nasdaq Rises As Earnings Roll; Fed Meeting, Microsoft, Google In Focus",0.0,0.0,1.0,0.0
MSFT,2023-07-25,2023-07-25T13:19:13+00:00,"GM &amp; Spotify results, big day for earnings: Top stories",0.44,0.034,0.87,0.096
MSFT,2023-07-25,2023-07-25T12:52:00+00:00,5 Forever Dividend Stocks,0.71,0.0,0.867,0.133
MSFT,2023-07-25,2023-07-25T11:36:51+00:00,10 Best Growth Mutual Funds and Their Latest Top Picks,0.999,0.03,0.812,0.158
MSFT,2023-07-25,2023-07-25T11:35:00+00:00,Schwab Is Not SVB,0.0,0.0,1.0,0.0
MSFT,2023-07-25,2023-07-25T11:30:34+00:00,U.S. stocks were rising as Microsoft and Alphabet kick off tech earnings,0.988,0.022,0.867,0.111
MSFT,2023-07-25,2023-07-25T11:25:01+00:00,Analysts Are Increasing Price Targets of These 10 Stocks,1.0,0.024,0.827,0.149
MSFT,2023-07-25,2023-07-25T11:00:00+00:00,Could the Recent AI Move by Microsoft and Meta Be a Red Flag for Nvidia?,0.0,0.0,1.0,0.0
MSFT,2023-07-25,2023-07-25T10:46:51+00:00,"Dow Jones Futures Rise As Dow Rides Win Streak; Fed Meeting, Tech Titans On Tap",0.44,0.08,0.759,0.16
MSFT,2023-07-25,2023-07-25T10:42:00+00:00,Microsoft and Alphabet Earnings Are Critical for This Stock Market Rally. Here’s Why.,-0.527,0.173,0.827,0.0
MSFT,2023-07-25,2023-07-25T10:02:00+00:00,"Stocks Mixed, General Motors, General Electric, Google, Microsoft Earnings On Deck - 5 Things To Know",0.743,0.028,0.81,0.162
MSFT,2023-07-25,2023-07-25T10:00:00+00:00,MORNING BID AMERICAS-Big Tech litmus test as Fed gathers,0.967,0.049,0.868,0.084
MSFT,2023-07-25,2023-07-25T09:40:45+00:00,"AI’s Grip on Tech Set for Test With Microsoft, Alphabet Earnings",0.976,0.04,0.894,0.066
MSFT,2023-07-25,2023-07-25T09:37:00+00:00,"These Stocks Are Moving the Most Today: F5, Logitech, Cadence Design, GE, GM, Microsoft, Alphabet, and More",0.772,0.0,0.811,0.189
MSFT,2023-07-25,2023-07-25T09:30:00+00:00,Inside Google’s scramble to reinvent its $160 billion search business—and survive the A.I. revolution,1.0,0.057,0.841,0.102
MSFT,2023-07-25,2023-07-25T09:20:00+00:00,"The Zacks Analyst Blog Highlights Microsoft, Alphabet, Synopsis, NetEase and Palantir",0.999,0.035,0.855,0.109
MSFT,2023-07-25,2023-07-25T09:10:23+00:00,Trending tickers: Microsoft l Alphabet l LVMH l Unilever,0.997,0.03,0.852,0.118
MSFT,2025-01-29,2025-01-29T23:01:24+00:00,NVIDIA stock gains after-hours as tech giants continue to pour money into AI,0.974,0.02,0.849,0.131
MSFT,2025-01-29,2025-01-29T19:30:13+00:00,Not Just DeepSeek - Alibaba Unveils AI Model To Rival OpenAI's Operator,0.972,0.018,0.913,0.069
MSFT,2025-01-29,2025-01-29T19:00:43+00:00,Yacktman Asset Management Significantly Reduces Booking Holdings Inc. Position,0.996,0.011,0.85,0.139
MSFT,2025-01-29,2025-01-29T17:30:00+00:00,Big Tech's AI capex will be just as important as earnings results,0.972,0.026,0.868,0.106
MSFT,2025-01-29,2025-01-29T17:25:37+00:00,DeepSeek clouds AI picture just as Big Tech is set to report earnings,0.988,0.029,0.889,0.082
MSFT,2025-01-29,2025-01-29T16:57:05+00:00,NVIDIA stock back under pressure as DeepSeek questions persist,0.494,0.046,0.891,0.063
MSFT,2025-01-29,2025-01-29T16:52:01+00:00,China's DeepSeek AI is raising US security concerns. Here's why.,0.95,0.024,0.887,0.089
MSFT,2025-01-29,2025-01-29T16:13:40+00:00,"Microsoft, Meta Capex Outlooks Face Scrutiny as DeepSeek Emerges as AI Rival, Wedbush Says",0.0,0.0,1.0,0.0
MSFT,2025-01-29,2025-01-29T16:07:29+00:00,DeepSeek's AI shakeup: Why Big Tech won’t cut spending,0.961,0.019,0.868,0.113
MSFT,2025-01-29,2025-01-29T15:37:35+00:00,Microsoft Probes Chinese AI Startup DeepSeek Over Potential OpenAI Data Breach,0.939,0.044,0.846,0.11
MSFT,2025-01-29,2025-01-29T15:16:00+00:00,"Mag 7 Earnings: Tesla, Microsoft &amp; Meta in Focus",1.0,0.012,0.856,0.132
MSFT,2025-01-29,2025-01-29T14:48:00+00:00,It’s Not Just DeepSeek. A Guide to the Chinese AI Companies You Need to Know.,0.077,0.0,0.954,0.046
MSFT,2025-01-29,2025-01-29T14:45:00+00:00,"Big Tech earnings: Will AI spend pay off for Meta, Microsoft, Tesla?",0.892,0.012,0.91,0.077
MSFT,2025-01-29,2025-01-29T14:30:00+00:00,Microsoft to Report Q2 Earnings Today: ETFs to Watch,0.999,0.014,0.86,0.125
MSFT,2025-01-29,2025-01-29T14:17:00+00:00,Microsoft’s Spending Is the Focus for Earnings. DeepSeek Changed the Game.,0.0,0.0,1.0,0.0
MSFT,2025-01-29,2025-01-29T14:13:07+00:00,Alibaba Surges as AI Battle Heats Up; Nvidia Rebounds After Historic Loss,-0.869,0.094,0.861,0.044
MSFT,2025-01-29,2025-01-29T14:12:58+00:00,"Big Tech earnings, Fed rate decision, ASML: 3 Things",0.836,0.008,0.937,0.055
MSFT,2025-01-29,2025-01-29T14:12:07+00:00,Why Microsoft (MSFT) Is the Best Stock to Buy in 2025 for Beginners,0.995,0.016,0.893,0.091
MSFT,2025-01-29,2025-01-29T13:50:47+00:00,"Report recommends CMA board consider probing AWS, Microsoft cloud services",0.992,0.021,0.871,0.109
MSFT,2025-01-29,2025-01-29T13:28:04+00:00,"Microsoft Set to Gain as DeepSeek AI Slashes Costs, Analysts Say",0.971,0.03,0.826,0.144
MSFT,2025-01-29,2025-01-29T12:27:00+00:00,"DeepSeek AI Fears Haunt Meta, Microsoft Earnings. What Stock Markets Need to See and 5 Other Things to Know Today.",-0.542,0.124,0.836,0.04
MSFT,2025-01-29,2025-01-29T12:00:00+00:00,U.S. Businesses Already Love DeepSeek,-0.026,0.026,0.95,0.024
MSFT,2025-01-29,2025-01-29T11:52:30+00:00,Microsoft Corporation (MSFT): Exploring AI Expansion with TikTok Acquisition Talks,0.996,0.038,0.837,0.125
MSFT,2025-01-29,2025-01-29T11:27:00+00:00,"The Zacks Analyst Blog Highlights NVIDIA, Broadcom, Amphenol, Microsoft and Meta Platform",0.999,0.017,0.843,0.139
MSFT,2025-01-29,2025-01-29T11:20:51+00:00,"Market Chatter: Microsoft, OpenAI Find Evidence DeepSeek Breached Rules in Developing AI Models",0.0,0.0,1.0,0.0
MSFT,2025-01-29,2025-01-29T11:09:09+00:00,"DeepSeek's AI Breakthrough Sparks Microsoft, OpenAI Probe Into Possible Data Breach",0.81,0.029,0.906,0.065
MSFT,2025-01-29,2025-01-29T11:05:16+00:00,"OpenAI's Next Move With Microsoft: Bigger Than Anyone Thinks, Says CEO Sam Altman",0.859,0.05,0.857,0.093
MSFT,2025-01-29,2025-01-29T10:30:07+00:00,DeepSeek whammy shifts focus to Big Tech trio’s earnings reports,0.989,0.035,0.88,0.085
MSFT,2025-01-29,2025-01-29T10:29:00+00:00,"These Stocks Are Moving the Most Today: ASML, Nvidia, Tesla, Microsoft, Meta, F5, LendingClub, and More",0.202,0.0,0.945,0.055
MSFT,2025-01-29,2025-01-29T09:19:25+00:00,Wall Street stalls ahead of Fed decision as FTSE closes higher,1.0,0.049,0.848,0.103
MSFT,2025-01-29,2025-01-29T09:07:58+00:00,"Tech earnings ahead, Fed decision, ASML reports - what's moving markets",-0.495,0.078,0.842,0.08
MSFT,2025-01-29,2025-01-29T05:32:55+00:00,Jim Cramer on Microsoft Corporation (MSFT): ‘This Has Become A Battleground Stock’,0.96,0.076,0.833,0.091
MSFT,2025-01-29,2025-01-29T00:00:00+00:00,Who Owns ChatGPT?,0.0,0.0,1.0,0.0
NVDA,2024-02-21,2024-02-21T23:55:01+00:00,Nvidia Surges After AI Boom Shows No Signs of Letting Up,0.996,0.032,0.875,0.093
NVDA,2024-02-21,2024-02-21T23:32:00+00:00,NVIDIA Earnings: Another Beat Delivered,0.991,0.013,0.864,0.123
NVDA,2024-02-21,2024-02-21T23:30:43+00:00,Nvidia Reported Earnings Tonight. Its Shares Are Rising,0.511,0.0,0.896,0.104
NVDA,2024-02-21,2024-02-21T23:12:49+00:00,"Nvidia stock surges after results, lifts other AI shares",0.974,0.017,0.886,0.097
